[
  {
    "id": "P001",
    "brand": "Acme Paws",
    "product": "Adult Chicken & Rice (kibble)",
    "species": "dog",
    "life_stage": "adult",
    "form": "dry",
    "kcal_per_100g": 1500,
    "protein_pct": 28.8,
    "fat_pct": 18.9,
    "moisture_pct": 7.7,
    "fibre_pct": 2.9,
    "source_url": "https://example.com/products/p001",
    "source_date": "2024-04-20",
    "label_year": 2024
  },
  {
    "id": "P002",
    "brand": "Silver Whisker",
    "product": "Kitten Salmon (kibble)",
    "species": "cat",
    "life_stage": "senior",
    "form": "dry",
    "kcal_per_100g": 395.3,
    "protein_pct": 35.3,
    "fat_pct": 17.4,
    "moisture_pct": 7.8,
    "fibre_pct": 4.9,
    "source_url": "https://example.com/products/p002",
    "source_date": "2025-05-28",
    "label_year": 2025
  },
  {
    "id": "P003",
    "brand": "Bowl & Bone",
    "product": "Puppy Lamb (pouch)",
    "species": "dog",
    "life_stage": "senior",
    "form": "wet",
    "kcal_per_100g": 110.8,
    "protein_pct": 10.4,
    "fat_pct": 5.2,
    "moisture_pct": 77.8,
    "fibre_pct": 0.7,
    "source_url": "https://example.com/products/p003",
    "source_date": "2023-08-14",
    "label_year": 2023
  },
  {
    "id": "P004",
    "brand": "Silver Whisker",
    "product": "Hairball Tuna (kibble)",
    "species": "cat",
    "life_stage": "senior",
    "form": "dry",
    "kcal_per_100g": 354,
    "protein_pct": 37.7,
    "fat_pct": 14,
    "moisture_pct": 8.3,
    "fibre_pct": 4,
    "source_url": "https://example.com/products/p004",
    "source_date": "2023-04-28",
    "label_year": 2023
  },
  {
    "id": "P005",
    "brand": "Terra Vita",
    "product": "Active Beef (kibble)",
    "species": "dog",
    "life_stage": "adult",
    "form": "dry",
    "kcal_per_100g": 396.4,
    "protein_pct": 280,
    "fat_pct": 14.4,
    "moisture_pct": 9.1,
    "fibre_pct": 2.4,
    "source_url": "https://example.com/products/p005",
    "source_date": "2024-03-05",
    "label_year": 2024
  },
  {
    "id": "P006",
    "brand": "Oakridge",
    "product": "Kitten Salmon (pouch)",
    "species": "cat",
    "life_stage": "kitten",
    "form": "wet",
    "kcal_per_100g": 96.1,
    "protein_pct": 11,
    "fat_pct": 4.9,
    "moisture_pct": 78.8,
    "fibre_pct": 1,
    "source_url": "https://example.com/products/p006",
    "source_date": "2024-02-28",
    "label_year": 2024
  },
  {
    "id": "P007",
    "brand": "Marlow",
    "product": "Puppy Lamb (kibble)",
    "species": "dog",
    "life_stage": "puppy",
    "form": "dry",
    "kcal_per_100g": 403.7,
    "protein_pct": 22.2,
    "fat_pct": 10.1,
    "moisture_pct": 0.1,
    "fibre_pct": 3.6,
    "source_url": "https://example.com/products/p007",
    "source_date": "2025-12-17",
    "label_year": 2025
  },
  {
    "id": "P008",
    "brand": "Silver Whisker",
    "product": "Hairball Tuna (kibble)",
    "species": "cat",
    "life_stage": "adult",
    "form": "dry",
    "kcal_per_100g": 403.4,
    "protein_pct": 30.7,
    "fat_pct": 14,
    "moisture_pct": 10,
    "fibre_pct": 4.7,
    "source_url": "https://example.com/products/p008",
    "source_date": "2023-06-02",
    "label_year": 2023
  },
  {
    "id": "P009",
    "brand": "Hearth Pet",
    "product": "Adult Chicken & Rice (pouch)",
    "species": "dog",
    "life_stage": "puppy",
    "form": "wet",
    "kcal_per_100g": 91.9,
    "protein_pct": 9.4,
    "fat_pct": 4.3,
    "moisture_pct": 76.3,
    "fibre_pct": 0.8,
    "source_url": "https://example.com/products/p009",
    "source_date": "2024-06-24",
    "label_year": 2024
  },
  {
    "id": "P010",
    "brand": "Terra Vita",
    "product": "Senior Turkey (kibble)",
    "species": "cat",
    "life_stage": "senior",
    "form": "dry",
    "kcal_per_100g": 422,
    "protein_pct": 31.2,
    "fat_pct": 17.1,
    "moisture_pct": 7.4,
    "fibre_pct": 3,
    "source_url": "https://example.com/products/p010",
    "source_date": "2023-11-27",
    "label_year": 2023
  },
  {
    "id": "P011",
    "brand": "Hearth Pet",
    "product": "Puppy Lamb (kibble)",
    "species": "dog",
    "life_stage": "senior",
    "form": "dry",
    "kcal_per_100g": 1200,
    "protein_pct": 27.1,
    "fat_pct": 16.2,
    "moisture_pct": 9.5,
    "fibre_pct": 4.4,
    "source_url": "https://example.com/products/p011",
    "source_date": "2025-11-08",
    "label_year": 2025
  },
  {
    "id": "P012",
    "brand": "Acme Paws",
    "product": "Kitten Salmon (pouch)",
    "species": "cat",
    "life_stage": "adult",
    "form": "wet",
    "kcal_per_100g": 100.7,
    "protein_pct": 11,
    "fat_pct": 6.1,
    "moisture_pct": 77.7,
    "fibre_pct": 0.8,
    "source_url": "https://example.com/products/p012",
    "source_date": "2025-07-24",
    "label_year": 2025
  },
  {
    "id": "P013",
    "brand": "Oakridge",
    "product": "Puppy Lamb (kibble)",
    "species": "dog",
    "life_stage": "adult",
    "form": "dry",
    "kcal_per_100g": 414.7,
    "protein_pct": 31.3,
    "fat_pct": 12,
    "moisture_pct": 7.6,
    "fibre_pct": 3.8,
    "source_url": "https://example.com/products/p013",
    "label_year": 2023
  },
  {
    "id": "P014",
    "brand": "Northfield",
    "product": "Senior Turkey (kibble)",
    "species": "cat",
    "life_stage": "senior",
    "form": "dry",
    "kcal_per_100g": 391.8,
    "protein_pct": 34.9,
    "fat_pct": 19.8,
    "moisture_pct": 8.7,
    "fibre_pct": 3.5,
    "source_url": "https://example.com/products/p014",
    "source_date": "2025-11-04",
    "label_year": 2025
  },
  {
    "id": "P015",
    "brand": "Hearth Pet",
    "product": "Sensitive Duck (pouch)",
    "species": "dog",
    "life_stage": "senior",
    "form": "wet",
    "kcal_per_100g": 83.4,
    "protein_pct": 12.8,
    "fat_pct": 4.3,
    "moisture_pct": 76.7,
    "fibre_pct": 0.7,
    "source_url": "https://example.com/products/p015",
    "source_date": "2024-05-20",
    "label_year": 2024
  },
  {
    "id": "P016",
    "brand": "Oakridge",
    "product": "Indoor Chicken (kibble)",
    "species": "cat",
    "life_stage": "kitten",
    "form": "dry",
    "kcal_per_100g": 343.4,
    "protein_pct": 36.3,
    "fat_pct": 12.7,
    "moisture_pct": 9.3,
    "fibre_pct": 3,
    "source_url": "https://example.com/products/p016",
    "source_date": "2023-11-23",
    "label_year": 2023
  },
  {
    "id": "P016",
    "brand": "Acme Paws",
    "product": "Senior Light Turkey (kibble)",
    "species": "dog",
    "life_stage": "puppy",
    "form": "dry",
    "kcal_per_100g": 371.8,
    "protein_pct": 28,
    "fat_pct": 16.5,
    "moisture_pct": 9.5,
    "fibre_pct": 2.3,
    "source_url": "https://example.com/products/p017",
    "source_date": "2024-03-12",
    "label_year": 2024
  },
  {
    "id": "P018",
    "brand": "Silver Whisker",
    "product": "Sterilised Rabbit (pouch)",
    "species": "cat",
    "life_stage": "adult",
    "form": "wet",
    "kcal_per_100g": 115.9,
    "protein_pct": 12.3,
    "fat_pct": 5.5,
    "moisture_pct": 81.9,
    "fibre_pct": 1.4,
    "source_url": "https://example.com/products/p018",
    "source_date": "2023-05-13",
    "label_year": 2023
  },
  {
    "id": "P019",
    "brand": "Silver Whisker",
    "product": "Active Beef (kibble)",
    "species": "puppy",
    "life_stage": "senior",
    "form": "dry",
    "kcal_per_100g": 417.6,
    "protein_pct": 25.2,
    "fat_pct": 13.7,
    "moisture_pct": 9.6,
    "fibre_pct": 3.4,
    "source_url": "https://example.com/products/p019",
    "source_date": "2024-02-26",
    "label_year": 2024
  },
  {
    "id": "P020",
    "brand": "Oakridge",
    "product": "Hairball Tuna (kibble)",
    "species": "cat",
    "life_stage": "kitten",
    "form": "dry",
    "kcal_per_100g": 383,
    "protein_pct": 30.8,
    "fat_pct": 12.6,
    "moisture_pct": 8.6,
    "fibre_pct": 2.3,
    "source_url": "https://example.com/products/p020",
    "source_date": "2024-05-16",
    "label_year": 2024
  },
  {
    "id": "P021",
    "brand": "Marlow",
    "product": "Grain-Free Salmon (pouch)",
    "species": "dog",
    "life_stage": "senior",
    "form": "wet",
    "kcal_per_100g": 89.3,
    "protein_pct": 10.1,
    "fat_pct": 5.4,
    "moisture_pct": 77.4,
    "fibre_pct": 0.8,
    "source_url": "https://example.com/products/p021",
    "source_date": "2023-06-22",
    "label_year": 2023
  },
  {
    "id": "P022",
    "brand": "Terra Vita",
    "product": "Adult Beef (kibble)",
    "species": "cat",
    "life_stage": "kitten",
    "form": "dry",
    "kcal_per_100g": 366.6,
    "protein_pct": 32.9,
    "fat_pct": 14.7,
    "moisture_pct": 7.6,
    "fibre_pct": 2.1,
    "source_url": "https://example.com/products/p022",
    "source_date": "2025-04-06",
    "label_year": 2025
  },
  {
    "id": "P023",
    "brand": "Acme Paws",
    "product": "Puppy Lamb (kibble)",
    "species": "dog",
    "life_stage": "adult",
    "form": "dry",
    "kcal_per_100g": 348.8,
    "protein_pct": 30.7,
    "fat_pct": 17.3,
    "moisture_pct": -5,
    "fibre_pct": 4.6,
    "source_url": "https://example.com/products/p023",
    "source_date": "2023-07-21",
    "label_year": 2023
  },
  {
    "id": "P024",
    "brand": "Silver Whisker",
    "product": "Indoor Chicken (pouch)",
    "species": "cat",
    "life_stage": "adult",
    "form": "wet",
    "kcal_per_100g": 95.9,
    "protein_pct": 10.1,
    "fat_pct": 4.6,
    "moisture_pct": 76.8,
    "fibre_pct": 1.4,
    "source_url": "https://example.com/products/p024",
    "source_date": "2023-07-18",
    "label_year": 2023
  },
  {
    "id": "P025",
    "brand": "Northfield",
    "product": "Sensitive Duck (kibble)",
    "species": "dog",
    "life_stage": "puppy",
    "form": "dry",
    "kcal_per_100g": 371,
    "protein_pct": 12,
    "fat_pct": 32,
    "moisture_pct": 9.6,
    "fibre_pct": 4.6,
    "source_url": "https://example.com/products/p025",
    "source_date": "2024-07-13",
    "label_year": 2024
  },
  {
    "id": "P026",
    "brand": "Terra Vita",
    "product": "Kitten Salmon (kibble)",
    "species": "cat",
    "life_stage": "senior",
    "form": "dry",